{"schema_version":"1.0","run_id":"run-2","task_ref":{"id":"task-2","revision":"r2","sha256":"bbbbbbbbbbbbbbbbbbbbbbbbbbbbbbbbbbbbbbbbbbbbbbbbbbbbbbbbbbbbbbbb"},"model":{"provider":"provider","id":"model","version":"2026-01","parameters":{"temperature":0}},"adapter":{"id":"adapter","version":"1","capabilities_hash":"bbbbbbbbbbbbbbbbbbbbbbbbbbbbbbbbbbbbbbbbbbbbbbbbbbbbbbbbbbbbbbbb"},"mode":{"id":"builder","version":"1"},"context_policy":{"id":"default","version":"1"},"toolset":{"id":"tools","sha256":"bbbbbbbbbbbbbbbbbbbbbbbbbbbbbbbbbbbbbbbbbbbbbbbbbbbbbbbbbbbbbbbb"},"runtime":{"provider":"local","version":"1","image_digest":"sha256:abc","network":{"allowed_hosts":["example.invalid"]},"secret_refs":["secret-ref://vault/item"],"limits":{"memory_mb":128}},"budget":{"tokens":1,"seconds":1,"tool_calls":1,"cost_usd":0},"verification_policy":{"id":"default","version":"1"},"policy_hash":"bbbbbbbbbbbbbbbbbbbbbbbbbbbbbbbbbbbbbbbbbbbbbbbbbbbbbbbbbbbbbbbb","seed":0,"experiment_id":"exp-1","trial_id":"trial-1","extensions":{"note":"informative"}}
