{"schema_version":"1.0","run_id":"run-1","task_ref":{"id":"task-1","revision":"r1","sha256":"aaaaaaaaaaaaaaaaaaaaaaaaaaaaaaaaaaaaaaaaaaaaaaaaaaaaaaaaaaaaaaaa"},"model":{"provider":"provider","id":"model","version":null,"parameters":{}},"adapter":{"id":"adapter","version":"1","capabilities_hash":"aaaaaaaaaaaaaaaaaaaaaaaaaaaaaaaaaaaaaaaaaaaaaaaaaaaaaaaaaaaaaaaa"},"mode":{"id":"builder","version":"1"},"context_policy":{"id":"default","version":"1"},"toolset":{"id":"none","sha256":"aaaaaaaaaaaaaaaaaaaaaaaaaaaaaaaaaaaaaaaaaaaaaaaaaaaaaaaaaaaaaaaa"},"runtime":{"provider":"local","version":"1","image_digest":null,"network":{"allowed_hosts":[]},"secret_refs":[],"limits":{}},"budget":{"tokens":null,"seconds":0,"tool_calls":0,"cost_usd":null},"verification_policy":{"id":"default","version":"1"},"policy_hash":"aaaaaaaaaaaaaaaaaaaaaaaaaaaaaaaaaaaaaaaaaaaaaaaaaaaaaaaaaaaaaaaa","seed":null,"experiment_id":null,"trial_id":null}
